"Design of Electric Power Enterprise Data Integration Platform Architecture Based on CIM","Y. Zhou; T. Xu","Sch. of Inf. & Electr. Eng., Shenyang Agric. Univ., Shenyang, China; Sch. of Inf. & Electr. Eng., Shenyang Agric. Univ., Shenyang, China","2015 International Conference on Computer Science and Mechanical Automation (CSMA)","","2015","","","144","148","The heterogeneity of information systems constructed in different historical periods by electric power enterprise produces the problem of Information Island, which affects the effective use of information resources. This paper starts with analyzing the adoption status of information systems within power utilities, summarizes the data source types and their relationships. Meanwhile, the data integration necessity in power utility is discussed, and the main problems that include the heterogeneous and distribution of data sources, no unified identifier for power system data entities, lacking of entity associations are analyzed minutely. In order to solve these problems, the data integration platform architecture is designed, which uses CIM as the common data model in electric power enterprise. Through data integration platform, the heterogeneous data sources are mapped to general CIM model, and then the data services are provided by the platform through the well-defined data service interfaces. The data users can request data service via data service interface, and retrieve the object set that accord with specific CIM profile. Moreover, the meta-database schema of data integration platform is introduced in detail. Through the meta-database, the problems that include establishing associations for entities of various data sources, and the unified identifiers for same entities are solved.","","978-1-4673-9166-5","10.1109/CSMA.2015.35","","https://ieeexplore.ieee.org/stamp/stamp.jsp?arnumber=7371639","electric power enterprise;power utility;data integration platform;common information model;heterogeneous data sources","Data integration;Data models;Business;Distributed databases;Geographic information systems","data integration;electricity supply industry;meta data;power engineering computing;power system identification","electric power enterprise data integration platform architecture;CIM;information system heterogeneity;power utility;well-defined data service interface;object set retrieve;metadatabase scheme;common information model","","","10","","","","","IEEE","IEEE Conferences"
"Demo: Diligent — An OSN Data Integration System Based on Reactive Microservices","A. Tsilingiris; I. Dimitriadis; A. Vakali; G. Andreadis","Aristotle Univ. of Thessaloniki, Aristotle, Greece; Aristotle Univ. of Thessaloniki, Aristotle, Greece; Aristotle Univ. of Thessaloniki, Aristotle, Greece; Aristotle Univ. of Thessaloniki, Aristotle, Greece","2018 IEEE International Conference on Smart Computing (SMARTCOMP)","","2018","","","285","287","This demo showcases some of the capabilities of Diligent, a platform for collecting and analysing data from Online Social Networks and is still under development. Diligent relies on microservices and reactive streams, which optimize the time spent (t), to the resources used (r), ratio (t/r). The proposed demo will present: - The vast hardware utilization margins produced by using both blocking and reactive I/O approaches. - The performance gap between using blocking I/O and Reactive I/O clients. Both experiments highlight the added benefits of using reactive approaches in online social network data processing systems.","","978-1-5386-4705-9","10.1109/SMARTCOMP.2018.00059","","https://ieeexplore.ieee.org/stamp/stamp.jsp?arnumber=8421373","data integration;data stream;social media data;data integration system;online social network;spring boot;databases;microservices;reactive","Data integration;Social network services;Hardware;Pipelines;Task analysis;Distributed databases","data analysis;data integration;social networking (online)","Diligent;online social network data processing systems;OSN data integration system;reactive microservices;data analysis;hardware utilization margins;blocking I-O clients;reactive I-O clients","","","7","","","","","IEEE","IEEE Conferences"
"An Enhanced Approach for Privacy Preserving Record Linkage during Data Integration","N. Shekokar; V. M. Shelake","D. J. Sanghvi College of Engineering,Department of Computer Engineering,Mumbai,India; D. J. Sanghvi College of Engineering,Department of Computer Engineering,Mumbai,India","2020 6th International Conference on Information Management (ICIM)","","2020","","","152","156","Today collecting and integrating data from multiple datasets has become a vital part to perform various analysis tasks. Record linkage plays an important component during data integration to detect and link similar data instances. However, personal and sensitive data need to be protected in a manner so that there is no re-identification of original attribute values by the party performing record linkage. Now-a-days, the Bloom filter encoding has utilized across many countries for privacy preserving record linkage. Moreover, the hardened approaches of Bloom filter encoding enhance privacy at the cost of reduced linkage accuracy. Still the security concerns remain with the Bloom filter encoding techniques because attackers can re-identify the obfuscated data with the use of available public resources. We propose an enhanced approach for privacy preserving record linkage (EPPRL) during data integration to achieve better privacy with acceptable linkage accuracy. The results show that the proposed approach EPPRL outperforms in comparison with Balanced Bloom filter encoding technique in terms of precision, recall, f-measure and re-identification of attribute values.","","978-1-7281-5770-2","10.1109/ICIM49319.2020.244689","","https://ieeexplore.ieee.org/stamp/stamp.jsp?arnumber=9081381","data integration;record linkage;accuracy;privacy;re-identification attack","","data integration;data privacy;data structures;security of data","enhanced approach;obfuscated data;reduced linkage accuracy;hardened approaches;Bloom filter encoding;sensitive data;personal data;similar data instances;data integration;privacy preserving record linkage","","","15","","","","","IEEE","IEEE Conferences"
"Semi-structured data dynamic integration mashup system","I. Kushniretska","Information Systems and Networks Department, Lviv Polytechnic National University Lviv, Ukraine","2016 XIth International Scientific and Technical Conference Computer Sciences and Information Technologies (CSIT)","","2016","","","140","142","The principles of functioning of the semi-structured data dynamic integration Mashup system have been described. The modern technologies of Mashup data integration realization have been considered. The basic processes of information resources processing into Mashup system have been characterized.","","978-1-5090-2740-8","10.1109/STC-CSIT.2016.7589890","","https://ieeexplore.ieee.org/stamp/stamp.jsp?arnumber=7589890","Mashup system;dynamic integration;data processing;semi-structured data","Mashups;Data integration;Information services;Data models;Data mining;Object oriented modeling;XML","data integration;data structures;information resources","semi-structured data dynamic integration;Mashup system;Mashup data integration;information resource","","2","7","","","","","IEEE","IEEE Conferences"
"A Hybrid Transaction Processing and Data Analysis Framework: A Use Case Study for Multi-Source Healthcare Data Management","Y. Tao; X. Wang; X. Xu; J. Yu","Dept. of Comput. Sci. & Technol., Qingdao Univ. of Sci. & Technol., Qingdao, China; Dept. of Inf. Eng., Ocean Univ. of China, Qingdao, China; Dept. of Inf. Eng., Ocean Univ. of China, Qingdao, China; Dept. of Inf. Eng., Ocean Univ. of China, Qingdao, China","2016 6th International Conference on Digital Home (ICDH)","","2016","","","165","169","Rapidly growing data volume demand systems that have the ability to handle massive heterogeneous unstructured data sets in digital home environment. However, currently, most existing mature transaction processing systems are built upon relational databases with structured data. In this paper, we design a hybrid development framework, to offer greater scalability and flexibility of data analysis and report, while keeping maximum compatibilities and links to the legacy platforms on which transaction business logics run. Data, service and user interfaces are implemented as a toolset stack, for developing applications with functionalities of information retrieval, data processing, analysing and visualizing. We discuss a use case of healthcare data integration as an example, where information is collected and aggregated from diverse sources such as electronic health records (EHRs), personal health records (PHRs) and wearable devices. We present the workflow of data processing and visualization, to validate the effectiveness of the proposed framework.","","978-1-5090-4400-9","10.1109/ICDH.2016.043","","https://ieeexplore.ieee.org/stamp/stamp.jsp?arnumber=8039102","hybrid framework;NoSQL;healthcare;data integration","Medical services;Data visualization;Databases;Data integration;Data analysis;Business","data analysis;data integration;data visualisation;electronic health records;health care;transaction processing;user interfaces","data analysis;heterogeneous unstructured data sets;toolset stack;electronic health records;EHR;personal health records;PHR;data visualization;transaction business logics;wearable devices;healthcare data integration;data processing;user interfaces;hybrid development framework;digital home environment;data volume demand systems;multisource healthcare data management;use case study;hybrid transaction processing","","1","11","","","","","IEEE","IEEE Conferences"
"Fingerprint clustering algorithm for data profiling using pentaho data integration","F. Dwiandriani; T. F. Kusumasari; M. A. Hasibuan","Information System Department, School of Industrial and System, Engineering, Telkom University, Bandung, Indonesia; Information System Department, School of Industrial and System, Engineering, Telkom University, Bandung, Indonesia; Information System Department, School of Industrial and System, Engineering, Telkom University, Bandung, Indonesia","2017 2nd International conferences on Information Technology, Information Systems and Electrical Engineering (ICITISEE)","","2017","","","359","363","Data profiling is an abnormality in the search process data that undermine the value of the data. Type of data profiling analysis techniques to detect duplication of text within a single paragraph can by using a text cluster. In this paper aims at doing text algorithm transformation cluster with fingerprint method using Pentaho Data Integration (PDI). As for methods used to conduct implementation text cluster with Pentaho Data Integration is to do a mapping algorithm fingerprint method on component contained in Pentaho, then perform a transformation per component, and further evaluation of the results of a text cluster with open source data profiling tool. Implementation of text clusters with Pentaho Data Integration successfully done but there is still some rudimentary logic. The results from implementation of clusters number on the transformation by using Pentaho Data Integration is greater than a number of text clusters by using the OpenRefine tool.","","978-1-5386-0658-2","10.1109/ICITISEE.2017.8285528","","https://ieeexplore.ieee.org/stamp/stamp.jsp?arnumber=8285528","Data profiling;text clustering;Pentaho Data integration;Fingerprint algorithm;open source","Fingerprint recognition;Clustering algorithms;Algorithm design and analysis;Databases;Data integration;Companies","business data processing;data analysis;data integration;fingerprint identification;pattern clustering;public domain software;text analysis","search process data;text algorithm transformation cluster;open source data profiling tool;Pentaho data integration;data profiling analysis;mapping algorithm fingerprint;OpenRefine tool;company data;fingerprint clustering algorithm","","","14","","","","","IEEE","IEEE Conferences"
"Challenges of data integration and interoperability in big data","A. Kadadi; R. Agrawal; C. Nyamful; R. Atiq","Department of Computer Systems Technology, North Carolina A & T State University, Greensboro, NC, USA; Department of Computer Systems Technology, North Carolina A & T State University, Greensboro, NC, USA; Department of Computer Systems Technology, North Carolina A & T State University, Greensboro, NC, USA; University of Arkansas at Pine Bluff, Pine Bluff, AR, USA","2014 IEEE International Conference on Big Data (Big Data)","","2014","","","38","40","The enormous volumes of data created and maintained by industries, research institutions are on the verge of outgrowing its infrastructure. The advancements in the organization's work flow include data storage, data management, data maintenance, data integration, and data interoperability. Among these levels, data integration and data interoperability can be the two major focus areas for the organizations which tend to implement advancements in their workflow. Overall, data integration and data interoperability influence the organization's performance. The data integration and data interoperability are complex challenges for the organizations deploying big data architectures due to the heterogeneous nature of data used by them. Therefore, it requires a comprehensive approach to negotiate the challenges in integration and interoperability. This paper focuses on the challenges of data integration and data interoperability in big data.","","978-1-4799-5666-1","10.1109/BigData.2014.7004486","","https://ieeexplore.ieee.org/stamp/stamp.jsp?arnumber=7004486","Data Integration;Data Interoperability","Data integration;Organizations;Interoperability;Big data;Aging;Standards organizations;Data mining","Big Data;data integration;organisational aspects;storage management","research institutions;organization work flow;data storage;data management;data maintenance;data interoperability;organization performance;big data architectures;data integration","","22","7","","","","","IEEE","IEEE Conferences"
"Application of Data Warehouse and Data Mining in the Steel Enterprise Information Integration System","S. Pei; G. Jia","Sch. of Phys. & Electron. Inf. Eng., Qinghai Univ. for Nat., Xining, China; Sch. of Phys. & Electron. Inf. Eng., Qinghai Univ. for Nat., Xining, China","2014 Sixth International Conference on Intelligent Human-Machine Systems and Cybernetics","","2014","2","","181","184","The Small&Medium steel enterprises is relatively weak on information technology, and the information management personnel lack the urgent need for information integration. According to the actual needs of the Small&Medium steel enterprises information management, three-tier architecture of information integration systems is proposed in this paper. By using SQL Server to implement database and data warehouse, data mining models is built and the design of information integration system is completed. The system covers the steel purchase, inventory, sale, distribution, contracts, finance, statistical analysis, decision support and other management functions. The proposed system can meet the Small&Medium steel enterprises scientific and orderly management for information resources, and the needs of managers forecasting, decision-making. Data warehouse and data mining applications can give an excellent support to the implementation of business intelligence in the future.","","978-1-4799-4955-7","10.1109/IHMSC.2014.146","","https://ieeexplore.ieee.org/stamp/stamp.jsp?arnumber=6911477","information integration system;three-tier architecture;data mining;data warehouse","Steel;Data warehouses;Data mining;Business;Algorithm design and analysis;Databases;Clustering algorithms","competitive intelligence;contracts;data integration;data mining;data warehouses;decision making;decision support systems;inventory management;purchasing;sales management;small-to-medium enterprises;SQL;statistical analysis;steel industry","data warehouse;steel enterprise information integration system;small-and-medium steel enterprises;information technology;information management personnel;three-tier architecture;SQL Server;database;data mining model;steel purchase;inventory;sale;distribution;contracts;finance;statistical analysis;decision support;management functions;information resources;forecasting;decision making;business intelligence","","","9","","","","","IEEE","IEEE Conferences"
"Research on XML Technology in Data Integration of Maritime","T. Li; Y. Chen; Y. Yu","Transp. Manage. Coll., Dalian Maritime Univ., Dalian, China; Transp. Manage. Coll., Dalian Maritime Univ., Dalian, China; Transp. Manage. Coll., Dalian Maritime Univ., Dalian, China","2012 International Conference on Computer Science and Service System","","2012","","","1563","1566","With the development of the transport sector maritime industry, in data integration, especially the import and export of data, lack an efficient and quick method. In this paper, we make a research on the XML technical features and design a new data integration structure, including modules for data import and export. Finally we use the new integration structure into practice. On the basis of the XML document, we achieve data import and data export, data file transfer, data validation, data assembly and so on. The experiment shows it has a great effect on improving the efficiency of daily work and promoting the development of industries.","","978-0-7695-4719-0","10.1109/CSSS.2012.391","","https://ieeexplore.ieee.org/stamp/stamp.jsp?arnumber=6394630","XML;data integration;data import;data export;data file transfer;XML data file validation;data assembly","XML;Databases;Standards;Marine vehicles;Educational institutions;Industries","data integration;marine engineering;ships;transportation;XML","transport sector maritime industry;XML technical features;data integration structure design;data import;data export;daily work efficiency improvement","","","4","","","","","IEEE","IEEE Conferences"
"Heterogeneous data integration model based on virtual view","J. Wu","Department of Electric and Electrical Engineering, Loudi Vocational and Technical College, Loudi, China","2012 7th International Conference on Computer Science & Education (ICCSE)","","2012","","","815","817","Consider the implementation of heterogeneous data integration, this paper employs virtual view to design and implement data integration model based on middleware integration. The model that supported by XML technology, refer to the SQL language, its access interface is the Web Service, it effectively resolve the heterogeneous data exchange and sharing.","","978-1-4673-0242-5","10.1109/ICCSE.2012.6295195","","https://ieeexplore.ieee.org/stamp/stamp.jsp?arnumber=6295195","XML;SQL;virtual view;Web Service;heterogeneous data integration","Data models;XML;Databases;Web services;Data mining","data integration;data models;information retrieval;middleware;SQL;Web services;XML","heterogeneous data integration model;virtual view;middleware integration;XML technology;SQL language;Web services;heterogeneous data exchange;heterogeneous data sharing;access interface","","","8","","","","","IEEE","IEEE Conferences"
"Data Source Selection for Large-Scale Deep Web Data Integration","X. Xian; P. Zhao; W. Fang; J. Xin; Z. Cui","Inst. of Intell. Inf. Process. & Applic., Soochow Univ., Suzhou, China; Inst. of Intell. Inf. Process. & Applic., Soochow Univ., Suzhou, China; Inst. of Intell. Inf. Process. & Applic., Soochow Univ., Suzhou, China; Inst. of Intell. Inf. Process. & Applic., Soochow Univ., Suzhou, China; Inst. of Intell. Inf. Process. & Applic., Soochow Univ., Suzhou, China","2009 Second Pacific-Asia Conference on Web Mining and Web-based Application","","2009","","","178","182","Deep Web has been an important resource on the Web due to its rich and high quality information, leading to emerging a new application area in data mining and integrates. There may be hundreds or thousands of data sources providing data of relevance to a particular domain on the Web, So a primary challenge to large-scale deep Web data integration is to determine in what order to user integrate candidate data sources. In this paper, we develop a most-benefit approach (MBA) for ordering candidate data sources for user integration. At the core of this approach is a utility function that quantifies the utility of a given the state of integration system; thus, we devise a utility function for integration system based on query result number. We show in practice how to efficiently apply MBA in concert with this utility function to order data sources. A detailed experimental evaluation on real datasets shows that the ordering of data sources produced by this MBA-based yields a integration system with a significantly higher utility than a wide range of other ordering strategies.","","978-0-7695-3646-0","10.1109/WMWA.2009.25","","https://ieeexplore.ieee.org/stamp/stamp.jsp?arnumber=5232496","deep web;data integration;most-benefit;order data source;data source selection","Large scale integration;Application software;Data mining;Crawlers;Costs;HTML;Information processing;Software engineering;Information technology;Rendering (computer graphics)","data mining;Internet;query processing","data source selection;large-scale deep Web data integration system;data mining;MBA;most-benefit approach;ordering candidate data source;utility function;query result number","","4","9","","","","","IEEE","IEEE Conferences"
"On-Demand Data Integration on the Cloud","S. A. Ghafour; M. Barhamgi; P. Ghodous","Claude Bernard Univ. Lyon 1, Villeurbanne, France; Claude Bernard Univ. Lyon 1, Villeurbanne, France; Claude Bernard Univ. Lyon 1, Villeurbanne, France","2014 IEEE 7th International Conference on Cloud Computing","","2014","","","924","927","On-demand data integration is among the key challenges in Cloud Computing. In this paper, we present an ontology-based framework for describing and integrating data on the fly to answer transient business needs. We provide a semantic modeling for cloud's data services. The proposed modeling makes it possible to automatically resolve the different types of data heterogeneity that would arise when data from heterogeneous and autonomous providers need to be combined together to answer the business's data needs.","2159-6190","978-1-4799-5063-8","10.1109/CLOUD.2014.127","","https://ieeexplore.ieee.org/stamp/stamp.jsp?arnumber=6973833","On-demand data integration;Ontologies;Services","Resource description framework;Ontologies;Semantics;Mashups;Business;Data integration","business data processing;cloud computing;data integration;ontologies (artificial intelligence)","on-demand data integration;cloud computing;ontology-based framework;transient business needs;semantic modeling;cloud data services;data heterogeneity;business data needs","","2","12","","","","","IEEE","IEEE Conferences"
"Data integration based approach to find shortest path within a city for different time periods","S. Kanjilal; S. Sen","Department of Computer Science, Dhruba Chand Haider College, Dakshin Barasat, India; A.K. Choudhury School of Information Technology, University of Calcutta, Kolkata, India","2016 5th International Conference on Reliability, Infocom Technologies and Optimization (Trends and Future Directions) (ICRITO)","","2016","","","233","238","Traditional data mining usually deals with data from single domain, however in modern day business applications the data may come from different domain for single application. Data sets are of multiple modalities. Each of them may have a different representation, distribution, scale and density. Data Integration techniques aggregate several domains of data sets and then represent in a unified form so that they can be used for data mining. In this research work data integration is considered in terms of the data collected from multiple modes of communication within a city and these data have been integrated and organized to infer more information. Here more information refers to generation of more numbers of routes in a city by combining multiple modes of communication. Further, this research work proposes an optimization in terms of searching path which is shortest in terms of time. The proposed methodology is executed on the historical data of different instances of day as well as different day of the week so that the relevant conditions or constraints associated with the traffic are included.","","978-1-5090-1489-7","10.1109/ICRITO.2016.7784957","","https://ieeexplore.ieee.org/stamp/stamp.jsp?arnumber=7784957","Data mining;Data Fusion;Linear Regression;Shortest Path Optimization;Transportation Route","Data integration;Urban areas;Transportation;Data mining;Optimization;Classification algorithms;Linear regression","data integration;data mining;inference mechanisms;optimisation","data integration;city shortest path finding;time periods;data mining;modern day business applications;information inference;city routes;communication multiple modes;searching path optimization","","","14","","","","","IEEE","IEEE Conferences"
