"A semantic framework for data integration and communication in project consortia","F. J. Ekaputra; E. Serral; D. Winkler; S. Biffl","Vienna University of Technology, Institute of Soft. Tech. & Information System, CDL-Flex, Vienna, Austria; KU Leuven, Dept. of Decision Sciences and Information Management, Leuven, Belgium; Vienna University of Technology, Institute of Soft. Tech. & Information System, CDL-Flex, Vienna, Austria; Inst. of Soft. Tech. & Inf. Syst., Vienna Univ. of Technol., Vienna, Austria","2014 International Conference on Data and Software Engineering (ICODSE)","","2014","","","1","6","Engineering project consortia represents the collaboration of different groups of partners to achieve a common goal, e.g., developing innovative products. This collaboration may be challenging because of different terminologies and different tools and data models used by the project partners. In this work, we present the concept of a Project Consortia Knowledge Base (PC-KB), an integration framework based on semantic knowledge that facilitates project-level communication as well as access to and querying of project data across tool and partner boundaries. The PC-KB allows establishing common data models on different abstraction layers within the consortia organization. Using these common models, the PC-KB integrates partner data to provide (a) a common terminology for facilitating communication among project partners and (b) a common consistent view for efficient data integration. The PC-KB has been successfully applied in the automation systems domain to improve collaboration and data exchange in heterogeneous engineering environments.","","978-1-4799-7996-7","10.1109/ICODSE.2014.7062487","","https://ieeexplore.ieee.org/stamp/stamp.jsp?arnumber=7062487","Project consortia;data integration;heterogeneous data environments;communication","Ontologies;Data models;Semantics;Collaboration;Knowledge based systems;Data integration;Organizations","data communication;data integration;data models;knowledge based systems;query processing;semantic networks","abstraction layer;project data query;data model;PC-KB;project consortia knowledge base;project-level communication;data integration;semantic knowledge","","","26","","","","","IEEE","IEEE Conferences"
"Probabilistic Integration of Large Brazilian Socioeconomic and Clinical Databases","C. Pinto; R. Pita; G. Barbosa; B. Araújo; J. Bertoldo; S. Sena; S. Reis; R. Fiaccone; L. Amorim; M. Y. Ichihara; M. Barreto; M. Barreto; S. Denaxas","Centre for Data & Knowledge Integration for Health, FIOCRUZ, Salvador, Brazil; Centre for Data & Knowledge Integration for Health, FIOCRUZ, Salvador, Brazil; Centre for Data & Knowledge Integration for Health, FIOCRUZ, Salvador, Brazil; Centre for Data & Knowledge Integration for Health, FIOCRUZ, Salvador, Brazil; Centre for Data & Knowledge Integration for Health, FIOCRUZ, Salvador, Brazil; Centre for Data & Knowledge Integration for Health, FIOCRUZ, Salvador, Brazil; Centre for Data & Knowledge Integration for Health, FIOCRUZ, Salvador, Brazil; Centre for Data & Knowledge Integration for Health, FIOCRUZ, Salvador, Brazil; Centre for Data & Knowledge Integration for Health, FIOCRUZ, Salvador, Brazil; Centre for Data & Knowledge Integration for Health, FIOCRUZ, Salvador, Brazil; Centre for Data & Knowledge Integration for Health, FIOCRUZ, Salvador, Brazil; Centre for Data & Knowledge Integration for Health, FIOCRUZ, Salvador, Brazil; Farr Inst. of Health Inf. Res., Univ. Coll. London, London, UK","2017 IEEE 30th International Symposium on Computer-Based Medical Systems (CBMS)","","2017","","","515","520","The integration of disparate large and heterogeneous socioeconomic and clinical databases is considered essential to capture and model longitudinal and social aspects of diseases. However, such integration is challenging: databases are stored in disparate locations, make use of different identifiers, have variable data quality, record information in bespoke purpose-specific formats and have different levels of metadata. Novel computational methods are required to integrate them and enable their statistical analyses for epidemiological research purposes. In this paper, we describe a probabilistic approach for constructing a very large population-based cohort comprised of 114 million individuals using linkages between clinical databases from the National Health System and administrative databases from governmental social programmes. We present our data integration model for creating data marts (epidemiological data) and discuss our evaluation results in controlled and uncontrolled scenarios, which demonstrate that our model and tools achieve high accuracy (minimum of 91%) in different probabilistic data integration scenarios.","2372-9198","978-1-5386-1710-6","10.1109/CBMS.2017.64","","https://ieeexplore.ieee.org/stamp/stamp.jsp?arnumber=8104248","Data integration;Probabilistic linkage;Health and social care data;Accuracy assessment","Databases;Couplings;Nickel;Probabilistic logic;Tools;Data integration","data integration;data warehouses;diseases;epidemics;medical computing;meta data;probability;statistical analysis","governmental social programmes;population-based cohort;metadata;Brazilian socioeconomic databases;different probabilistic data integration scenarios;epidemiological data;data marts;data integration model;administrative databases;probabilistic approach;epidemiological research purposes;bespoke purpose-specific formats;variable data quality;clinical databases;probabilistic integration","","1","20","","","","","IEEE","IEEE Conferences"
"Research and Application of Data Modeling and Integration Based on Metadata","J. Zheng; X. Li","Sch. of Comput. Sci. & Technol., Shandong Univ., Jinan, China; Sch. of Comput. Sci. & Technol., Shandong Univ., Jinan, China","2015 7th International Conference on Information Technology in Medicine and Education (ITME)","","2015","","","525","528","As various institutions' information management systems rely on heterogeneous data, these systems normally cannot share data inducing many information islands. In order to integrate various information management systems, a metadata-based data modeling and integration solution is proposed. First, we established a technical metadata model based on Shandong University information system platform, and built the business metadata model from other individual subservice systems. Second, we constructed business model and abstracted data integration operation into platform-independent model. XML was adopted to describe the details and contents, Additionally, MDA was leveraged to reduce the operating difficulty and improve the reusability. The proposed framework was implemented with Java EE. Experiments show that the proposed framework can efficiently integrate heterogeneous data.","","978-1-4673-8302-8","10.1109/ITME.2015.160","","https://ieeexplore.ieee.org/stamp/stamp.jsp?arnumber=7429204","metadata;information management;data modeling;integration","Metadata;Business;Data integration;Synchronization;XML;Databases","data integration;information management;Java;meta data;XML","information management system;metadata-based data modeling;metadata-based data integration;technical metadata model;Shandong University information system platform;business metadata model;XML;MDA;Java EE","","","5","","","","","IEEE","IEEE Conferences"
"Machine Learning to Data Management: A Round Trip","B. Laure; B. Angela; M. Tova","LIS, Aix-Marseille Univ., Marseille, France; LIRIS, Univ. Claude Bernard Lyon 1, Lyon, France; Tel Aviv Univ., Tel Aviv, Israel","2018 IEEE 34th International Conference on Data Engineering (ICDE)","","2018","","","1735","1738","With the emergence of machine learning (ML) techniques in database research, ML has already proved a tremendous potential to dramatically impact the foundations, algorithms, and models of several data management tasks, such as error detection, data cleaning, data integration, and query inference. Part of the data preparation, standardization, and cleaning processes, such as data matching and deduplication for instance, could be automated by making a ML model ""learn"" and predict the matches routinely. Data integration can also benefit from ML as the data to be integrated can be sampled and used to design the data integration algorithms. After the initial manual work to setup the labels, ML models can start learning from the new incoming data that are being submitted for standardization, integration, and cleaning. The more data supplied to the model, the better the ML algorithm can perform and deliver accurate results. Therefore, ML is more scalable compared to traditional and time-consuming approaches. Nevertheless, many ML algorithms require an out-of-the-box tuning and their parameters and scope are often not adapted to the problem at hand. To make an example, in cleaning and integration processes, the window sizes of values used for the ML models cannot be arbitrarily chosen and require an adaptation of the learning parameters. This tutorial will survey the recent trend of applying machine learning solutions to improve data management tasks and establish new paradigms to sharpen data error detection, cleaning, and integration at the data instance level, as well as at schema, system, and user levels.","2375-026X","978-1-5386-5520-7","10.1109/ICDE.2018.00226","","https://ieeexplore.ieee.org/stamp/stamp.jsp?arnumber=8509447","machine learning;data cleaning;error detection;data repairing;query inference;data management;clustering;classification","Databases;Task analysis;Cleaning;Data integration;Data models;Machine learning;Tutorials","data integration;data integrity;database management systems;inference mechanisms;learning (artificial intelligence);query processing","machine learning techniques;data management tasks;data cleaning;data preparation;data matching;deduplication;data integration algorithms;learning parameters;data error detection;data instance level;query inference","","","50","","","","","IEEE","IEEE Conferences"
"A Semantic Based Framework for the Purpose of Big Data Integration","D. Ostrowski; M. Kim","Ford Motor Co., Dearborn, MI, USA; Dept. of EECS, Univ. of California, Irvine, Irvine, CA, USA","2017 IEEE 11th International Conference on Semantic Computing (ICSC)","","2017","","","305","309","One of the most substantial opportunities in Big Data is to integrate disparate data sources across the enterprise. To realize this goal it can be valuable to leverage environments developed for high speed parallel processing as well as toolkits supporting the development and maintenance of semantic information. In support of this approach a proposed framework and methodology is presented to utilize an ontology-based data integration strategy. Our approach supports a rule-based translation to generate new ontology versions within a fast prototyping environment leveraging the Jena API within the context of the Apache Spark environment.","","978-1-5090-4284-5","10.1109/ICSC.2017.62","","https://ieeexplore.ieee.org/stamp/stamp.jsp?arnumber=7889553","Big Data;Data Integration;Ontology","Ontologies;Data integration;Big Data;Vehicles;Semantics;Reactive power","Big Data;business data processing;data integration;ontologies (artificial intelligence);parallel processing","Big Data integration;enterprise data sources;parallel processing;toolkits;semantic information development;semantic information maintenance;ontology-based data integration strategy;rule-based translation;fast prototyping environment;Jena API;Apache Spark","","","22","","","","","IEEE","IEEE Conferences"
"Data integration in manufacturing industry: Model-based integration of data distributed from ERP to PLC","J. Hufnagel; B. Vogel-Heuser","Institute of Automation and Information Systems, Technische Universität München, Garching bei München, Germany; Institute of Automation and Information Systems, Technische Universität München, Garching bei München, Germany","2015 IEEE 13th International Conference on Industrial Informatics (INDIN)","","2015","","","275","281","For manufacturing industry seamless workflows along the whole product lifecycle are crucial for sustainable success. Although the integration of all used systems to a single supersystem is not reasonable, the integration of data is essential. This contribution introduces a model-based concept to integrate data elements of distributed data systems and sources to one virtual database. Specific view models represent the information about data, their relations, properties and environments. The combination of these pieces of information allows the configuration of a middleware platform to establish the interconnection of related data elements across distributed IT systems. This approach tries to feature the missing link between the successful enterprise application integration concept, sophisticated XML-based technologies and established graphical description languages. Instead of a fixed development environment this approach introduces how to adapt and utilize UML and BPMN for a modular and parallelizable integration process to archive a highly company-specific but user-oriented data integration environment.","2378-363X","978-1-4799-6649-3","10.1109/INDIN.2015.7281747","","https://ieeexplore.ieee.org/stamp/stamp.jsp?arnumber=7281747","model-based;interoperability;data integration;data backbone;enterprise application integration;UML;BPMN;XML serialization","Unified modeling language;Data models;Data integration;Adaptation models;XML;Distributed databases","data integration;database management systems;enterprise resource planning;manufacturing industries;middleware;parallel processing;Unified Modeling Language;visual languages;XML","model-based integration;ERP;PLC;manufacturing industry seamless workflow;product lifecycle;distributed data systems;virtual database;view models;middleware platform;data elements;distributed IT systems;enterprise application integration concept;XML-based technologies;graphical description languages;UML;BPMN;modular integration process;parallelizable integration process;company-specific data integration environment;user-oriented data integration environment","","5","37","","","","","IEEE","IEEE Conferences"
"An analysis of the problems for Health Data integration in Bangladesh","S. I. Khan; A. S. M. L. Hoque","Department of Computer Science and Engineering (CSE), Bangladesh University of Engineering and Technology (BUET), Dhaka, Bangladesh; Department of Computer Science and Engineering (CSE), Bangladesh University of Engineering and Technology (BUET), Dhaka, Bangladesh","2016 International Conference on Innovations in Science, Engineering and Technology (ICISET)","","2016","","","1","4","Discovering the hidden knowledge from different health data repositories requires the integration of health data from widely diversified sources. While integration, maintaining record linkage is a critical research issue for developing countries such as Bangladesh. Researchers have given different solutions to this problem that are applicable for developed countries where electronic health record of patients are maintained with identifiers like social security number (SSN), Universal Patient Identifier (UPI), etc. These algorithms cannot be used for integrating health data in Bangladesh because of many missing data, different ID used for the same patient in same or different systems and high amount of noise in other patient information. In this paper, we have defined the constraining factors of healthcare date available in Bangladesh and other developing countries. We have analyzed the practical problems of collecting and integrating healthcare data in Bangladesh to build up its National Health Data Warehouse (NHDW). We have also provided some important recommendations to boost the integration process and also to support record linkage.","","978-1-5090-6122-8","10.1109/ICISET.2016.7856517","","https://ieeexplore.ieee.org/stamp/stamp.jsp?arnumber=7856517","Data Integration;Health Data Warehouse;Record Linkage;Bangladesh","Hospitals;Couplings;Data warehouses;Government;Medical diagnostic imaging","data integration;data warehouses;electronic health records;health care","Bangladesh;health data repositories;record linkage;electronic health record;missing data;patient information;healthcare date;National Health Data Warehouse;NHDW;healthcare data integration","","6","18","","","","","IEEE","IEEE Conferences"
"Research and application on the model of power parallel data integration","Y. Wei","Liaoning Jianzhu Vocational College, Liaoyang City, China","2018 IEEE 4th Information Technology and Mechatronics Engineering Conference (ITOEC)","","2018","","","1596","1600","This paper proposes a model of parallel data integration. Firstly, the paper design an standard interface system based on the Neo4j, which can carry on the interconnection of multi-source data; then there is the algorithm of parallel forward maximum matching to remove redundancy, which can filter redundant data within the system; finally it puts forward the method of data consistency processing for correlation degree, which can repair inconsistent data by determining the relation between data, according to the cosine of the angle between the feature vector value. By the experiment of data integration based on a electric power dispatching center, it can verify the validity of the data integration model.","","978-1-5386-5373-9","10.1109/ITOEC.2018.8740463","","https://ieeexplore.ieee.org/stamp/stamp.jsp?arnumber=8740463","parallel data integration;spark;dispatching center;Neo4j","Sparks;Data integration;Feature extraction;Task analysis;Data models;Correlation;Scalability","data integration;power engineering computing;power generation dispatch","redundancy;redundant data;data consistency processing;electric power;data integration model;power parallel data integration;standard interface system;Neo4j;multisource data;parallel forward maximum matching;feature vector value;electric power dispatching center","","","9","","","","","IEEE","IEEE Conferences"
"Data integration for incidents analysis in manufacturing infrastructure","P. Tanuska; L. Spendla; M. Kebisek","Faculty of Materials Science and Technology, Slovak University of Technology, Trnava, Slovakia; Faculty of Materials Science and Technology, Slovak University of Technology, Trnava, Slovakia; Faculty of Materials Science and Technology, Slovak University of Technology, Trnava, Slovakia","2017 Computing Conference","","2017","","","340","345","In the proposed paper, we have described new approach for incidents analysis of manufacturing infrastructure. The proposal is focused on initial steps of data mining process, specifically on data pre-processing and transformation. We have proposed integration process of data from the HP OpenView and Elasticsearch platform. From the analysed data we have presented two use cases, suitable for further detailed data analysis and utilisation of knowledge discovery process. Presented results originated from real production data.","","978-1-5090-5443-5","10.1109/SAI.2017.8252124","","https://ieeexplore.ieee.org/stamp/stamp.jsp?arnumber=8252124","big data;data integration;elasticsearch;hp openview;Hadoop;manufacturing data","Monitoring;Manufacturing;Companies;Production;Process control;Control systems;Databases","data analysis;data integration;data mining;manufacturing data processing","data integration;incidents analysis;manufacturing infrastructure;data mining process;data pre-processing;transformation;knowledge discovery process;production data;data analysis;Elasticsearch platform;HP OpenView","","","6","","","","","IEEE","IEEE Conferences"
"Big data integration architectural concepts for oil and gas industry","R. M. Alguliyev; R. M. Aliguliyev; M. S. Hajirahimova","Institute of Information Technology of ANAS, Baku, Azerbaijan; Institute of Information Technology of ANAS, Baku, Azerbaijan; Institute of Information Technology of ANAS, Baku, Azerbaijan","2016 IEEE 10th International Conference on Application of Information and Communication Technologies (AICT)","","2016","","","1","5","In recent years economic an social activity fields is based on data. Oil and gas industry leaders understand the value of big data and are interested in digital oil industry becoming a reality. Here is big data is analysed as a key component in based decision making in oil and gas industry during exploration, drilling and production. In oil and gas industry architectural model is offered for integration and convergence of big data, business analyticss and transaction data.","2472-8586","978-1-5090-1841-3","10.1109/ICAICT.2016.7991832","","https://ieeexplore.ieee.org/stamp/stamp.jsp?arnumber=7991832","oil and gas industry;big data;business analyticss;business intelligence;predictive analyticss;data mining;decision-making","Oils;Big Data;Natural gas industry;Production;Data models;Companies;Data integration","Big Data;data integration;gas industry;petroleum industry","Big Data integration;oil and gas industry;social activity fields;digital oil industry;decision making;Big Data convergence;business analytics;transaction data","","1","24","","","","","IEEE","IEEE Conferences"
"Exclusive technique for stocking and probing data table integration using the Internet","T. Divya; M. Nithya","Department of Computer Science and Engineering Sri Sairam Engineering College, Chennai, Tamilnadu; Department of Computer Science and Engineering, Sri Sairam Engineering College, Chennai, Tamilnadu","International Conference on Information Communication and Embedded Systems (ICICES2014)","","2014","","","1","5","The highly successful architecture and protocols of today's Internet may operate poorly in environments characterized by very long delay paths. People are great sources of unique information, especially that which is location-specific, community-specific and time-specific. We extant the design of ONDINE system which allows the loading and the querying of a data warehouse opened on the Web, directed by an Ontological and Terminological Resource (OTR). The ONtology-based Data INtEgration (ONDINE), using the semantic Web framework and language recommendations, which implement the entire management system, to supplement existing local data sources with data tables which have been extracted from Web documents. ONDINE system trusts on an Ontological and Terminological Resource (OTR). In Chief, we present the main steps of our semiautomatic method to annotate data tables driven by an OTR. The output of this method is an XML/RDF data warehouse composed of XML documents representing data tables with their fuzzy RDF annotations. This system relies on SPARQL and allows approximate answers to be retrieved. to compare old and new data, if there is any modification occurs, then the new document updated as the RDF file.","","978-1-4799-3834-6","10.1109/ICICES.2014.7033787","","https://ieeexplore.ieee.org/stamp/stamp.jsp?arnumber=7033787","Mobile networking;ontology based data integration;Network measurement;Wireless networking;Human Factors","Ontologies;Resource description framework;XML;Semantics;Fuzzy sets;Data warehouses;Educational institutions","data integration;data warehouses;Internet;ontologies (artificial intelligence);semantic Web;SQL;XML","data table integration;Internet;ONDINE system;data warehouse loading;data warehouse querying;ontological and terminological resource;ontology-based data integration;semantic Web framework;Web documents;data table annotation;OTR;XML-RDF data warehouse;XML documents;fuzzy RDF annotations;SPARQL","","","9","","","","","IEEE","IEEE Conferences"
"Data integration, semantic data representation and decision support for situational awareness in protection of critical assets","A. Badii; M. Tiemann; D. Thiemert","University of Reading, Whiteknights, RG6 6AH, U.K.; University of Reading, Whiteknights, RG6 6AH, U.K.; University of Reading, Whiteknights, RG6 6AH, U.K.","2014 International Conference on Signal Processing and Multimedia Applications (SIGMAP)","","2014","","","341","345","This paper presents the design and development of a system for data integration, data representation, situational awareness and decision support that has been developed in the EC-co-funded research project MOSAIC. The paper motivates the architecture and describes the data representation model and the developed system components. It discusses the approach for improved situational awareness and decision support as a novel integration of systems developed under the MOSAIC project as deployed for the protection of critical assets as a demonstrator.","","978-9-8985-6596-9","","","https://ieeexplore.ieee.org/stamp/stamp.jsp?arnumber=7514534","Data Representation;Semantic Web;Decision Support;Security","Data models;Ontologies;Production;Data integration;Semantic Web;Engines;Memory","data integration;data structures;security of data;semantic Web","data integration;semantic data representation;decision support;EC-co-funded research project;improved situational awareness;MOSAIC project;semantic Web;critical asset protection","","1","12","","","","","IEEE","IEEE Conferences"
