"Towards Building a Distributed Data Management Architecture to Integrate Multi-Sources Remote Sensing Big Data","X. Huang; L. Wang; J. Yan; Z. Deng; S. Wang; Y. Ma","Sch. of Comput. Sci., China Univ. of Geosci., Wuhan, China; Sch. of Comput. Sci., China Univ. of Geosci., Wuhan, China; Sch. of Comput. Sci., China Univ. of Geosci., Wuhan, China; Sch. of Comput. Sci., China Univ. of Geosci., Wuhan, China; Sch. of Comput. Sci., China Univ. of Geosci., Wuhan, China; Inst. of Remote Sensing & Digital Earth, Beijing, China","2018 IEEE 20th International Conference on High Performance Computing and Communications; IEEE 16th International Conference on Smart City; IEEE 4th International Conference on Data Science and Systems (HPCC/SmartCity/DSS)","","2018","","","83","90","Recent advances in sensor technologies have led to the significant growth of remote sensing data in terms of its volume, velocity, and variety. Remote sensing data are recognized as the big data, which pose the urgent need for new technologies to integrate and manage heterogeneous remote sensing big data. In this paper, a scalable, efficient, distributed data management system is proposed for heterogeneous remote sensing big data integration and management across the distributed environment. In the system, the remote sensing data are stored as NetCDF files. Meanwhile, the corresponding remote sensing metadata are standardized according to the ISO 19115-2:2009 based metadata template. In this way, a unified view of heterogeneous remote sensing data is formed. Two organization models are designed to store massive remote sensing data and its metadata in HDFS and HBase, respectively. Besides, an Elasticsearch-based secondary index is built for HBase to provide users with query ability of metadata contents.","","978-1-5386-6614-2","10.1109/HPCC/SmartCity/DSS.2018.00043","","https://ieeexplore.ieee.org/stamp/stamp.jsp?arnumber=8622781","Remote Sensing, Big Data, Data Integration, Data Management","Remote sensing;Distributed databases;Metadata;Data integration;Big Data;Indexes;Crawlers","Big Data;data integration;geophysics computing;meta data;remote sensing;Web services","sensor technologies;NetCDF files;HDFS;HBase;Elasticsearch-based secondary index;massive remote sensing data;corresponding remote sensing metadata;heterogeneous remote sensing big data integration;efficient distributed data management system;scalable distributed data management system;multisources remote sensing big data;distributed data management architecture","","","33","","","","","IEEE","IEEE Conferences"
"Automating data integration with HiperFuse","E. Huang; A. Quiroz; L. Ceriani","Interaction and Analytics Laboratory, Palo Alto Research Center, Palo Alto, CA USA; Interaction and Analytics Laboratory, Palo Alto Research Center, Palo Alto, CA USA; Interaction and Analytics Laboratory, Palo Alto Research Center, Palo Alto, CA USA","2014 IEEE International Conference on Big Data (Big Data)","","2014","","","863","867","Integrating heterogeneous datasets has been a significant barrier to many analytics tasks, due to the variety in structure and level of cleanliness of raw datasets requiring one-off ETL code. We propose HiperFuse, which significantly automates the data integration process by providing a declarative interface, robust type inference, extensible domain-specific data models, and a data integration planner which optimizes for plan completion time.","","978-1-4799-5666-1","10.1109/BigData.2014.7004316","","https://ieeexplore.ieee.org/stamp/stamp.jsp?arnumber=7004316","data integration;data fusion;declarative;ETL;DSL;dataflow optimization;planning;scheduling;automation","Data models;IP networks;Data integration;Planning;Libraries;Benchmark testing;Computational modeling","data integration;data models","HiperFuse;heterogeneous dataset integration;one-off ETL code;declarative interface;robust type inference;extensible domain-specific data models;data integration planner","","","16","","","","","IEEE","IEEE Conferences"
"A Model for Dynamic Integration of Data Sources","M. Obali; B. Dursun","NA; NA","2012 IEEE/ACM International Conference on Advances in Social Networks Analysis and Mining","","2012","","","844","849","Online and offline data is the key to Intelligence Agents, but these data cannot be fully analyzed due to the wealth and complexity and non-integrated nature of the information available. In the field of security and intelligence, there is a huge number of data coming from heterogonous data sources in different formats. The integration and the management of these data are very costly and time consuming. The result is a great need for dynamic integration of these intelligent data. In this paper, we propose a complete model that integrates different online and offline data sources. This model takes part between the data sources and our applications.","","978-1-4673-2497-7","10.1109/ASONAM.2012.153","","https://ieeexplore.ieee.org/stamp/stamp.jsp?arnumber=6425654","online;offline;data source;infotype;information fusion","Data models;Data structures;Adaptation models;Feature extraction;Ontologies;Data mining;Security","data integration;distributed databases;information retrieval systems;security of data;software agents","dynamic integration model;intelligent agents;data security;heterogonous data sources;data management;dynamic intelligent data integration;online data sources;offline data sources;information fusion","","1","10","","","","","IEEE","IEEE Conferences"
"A requirements driven approach to data warehouse consolidation","D. Prakash; N. Prakash","School of Mathematics, Statistics, and Computational Science, Central University of Rajasthan, Kishangarh 305817, India; ICLC, 21/4, S. Bhagat Singh Marg, New Delhi 110001, India","2017 11th International Conference on Research Challenges in Information Science (RCIS)","","2017","","","449","450","Data mart consolidation does schema as well as data integration of data marts so as to produce a single physical data mart/warehouse. This implies that multiple data marts must exist. Our proposal is to integrate requirements specifications of data marts. This upstream integration saves the effort of downstream activities performed when data marts are independently developed and then integrated. Without this integration, we get a new problem of loss of business control. Our integration approach is organized in five steps.","2151-1357","978-1-5090-5476-3","10.1109/RCIS.2017.7956580","","https://ieeexplore.ieee.org/stamp/stamp.jsp?arnumber=7956580","Data mart integration;data mart consolidation;Data Warehouse for policy enforcement rules;Operational data warehouse;Early Information;Correspondence strategy","Data warehouses;Data integration;Proposals;Organizations;Databases;Mathematics","data integration;data warehouses;formal specification;formal verification;systems analysis","requirements driven approach;data warehouse consolidation;data mart consolidation;data integration;requirements specifications","","","11","","","","","IEEE","IEEE Conferences"
"A conflict conciliation strategy in data integration","Jing Tian","Postdoctoral workstation of credit reference center, the People's Bank of China, Beijing, China","2017 IEEE 2nd International Conference on Cloud Computing and Big Data Analysis (ICCCBDA)","","2017","","","19","23","The advancements of Internet accelerate the intelligent process of data integration in recent years. When fusing a volume of records about the same real-world entity into a single, consistent and clean representation, appropriate conflicts conciliation becomes essential for participants. This paper advocates a strategic framework for perceiving and resolving data inconsistencies via employing truth finding and data fusion. The experimental result shows that the algorithm could leverage correctness and time consuming concurrently.","","978-1-5090-4499-3","10.1109/ICCCBDA.2017.7951877","","https://ieeexplore.ieee.org/stamp/stamp.jsp?arnumber=7951877","data integration;conflicts conciliation;strategic framework;truth finding;data fusion","Data mining;Ions;Ontologies","data integration;Internet;sensor fusion","conflict conciliation strategy;data integration;Internet;intelligent process;data inconsistencies;data fusion;truth finding","","","23","","","","","IEEE","IEEE Conferences"
"HL7 Data Acquisition & Integration: Challenges and Best Practices","S. Sinha; M. Seys","Corporate Data & Analytics, Premera Blue Cross, Mountlake Terrace, WA, USA; Corporate Data & Analytics, Premera Blue Cross, Mountlake Terrace, WA, USA","2018 IEEE International Conference on Big Data (Big Data)","","2018","","","2453","2457","Lack of interoperability between health data systems is a leading challenge for healthcare in the United States. This paper describes the challenges and lessons learned in the process of incorporating HL7 data and integration with Electronic Health Records and Health Information Exchanges from the perspective of a midsized Health Plan (Payer). As a Health Care Payer, Premera has a unique perspective regarding how health plans can provide the necessary data to complete the picture of care. This paper shares some of the best practices and focus areas for successful implementation of healthcare data integrations. This paper also focuses on integrating claims and clinical data using a master patient index as well as challenges faced in that process.Note that going forward `Health Plan' and `Payer' will be used interchangeably. Also, `Provider(s)', `Hospitals', `Healthcare Providers', `Clinics', `Provider Organizations' will be used interchangeably and in the context of this paper may mean the same.","","978-1-5386-5035-6","10.1109/BigData.2018.8622349","","https://ieeexplore.ieee.org/stamp/stamp.jsp?arnumber=8622349","HL7;big data;integration;acquisition;master patient index;payer;interoperability;data quality","Medical services;Organizations;Standards organizations;Engines;Monitoring;Best practices;Interoperability","data acquisition;data integration;health care;medical information systems;open systems;quality management","healthcare data integrations;clinical data;health data systems;leading challenge;United States;health plans;healthcare providers;health care payer;midsized health plan;HL7 data acquisition & integration;electronic health records;health information exchanges","","","18","","","","","IEEE","IEEE Conferences"
"The Deep Data Warehouse: Link-Based Integration and Enrichment of Warehouse Data and Unstructured Content","C. Gröger; H. Schwarz; B. Mitschang","Inst. of Parallel & Distrib. Syst., Univ. of Stuttgart, Stuttgart, Germany; Inst. of Parallel & Distrib. Syst., Univ. of Stuttgart, Stuttgart, Germany; Inst. of Parallel & Distrib. Syst., Univ. of Stuttgart, Stuttgart, Germany","2014 IEEE 18th International Enterprise Distributed Object Computing Conference","","2014","","","210","217","Data warehouses are at the core of enterprise IT and enable the efficient storage and analysis of structured data. Besides, unstructured content, e.g., emails and documents, constitutes more than half of the entire enterprise data and contains a lot of implicit knowledge about warehouse entities. Thus, holistic ana-lytics require the integration of structured warehouse data and unstructured content to generate novel insights. These insights can also be used to enrich the integrated data and to create a new basis for further analytics. Existing integration approaches only support a limited range of analytical applications and require the costly adaptation of the warehouse schema. In this paper, we present the Deep Data Warehouse (DeepDWH), a novel type of data warehouse based on the flexible integration and enrichment of warehouse data and unstructured content, addressing the variety challenge of Big Data. It relies on information-rich in-stance-level links between warehouse elements and content items, which are represented in a graph-oriented structure. Neither adaptations of the existing warehouse nor the design of an overall federated schema are required. We design a conceptual linking model and develop a logical schema for links based on a property graph. As a proof of concept, we present a prototypical imple-mentation of the DeepDWH including a link store based on a graph database.","1541-7719","978-1-4799-5470-4","10.1109/EDOC.2014.36","","https://ieeexplore.ieee.org/stamp/stamp.jsp?arnumber=6972069","data warehouse;data integration;unstructured data;link-based integration;graph data","Data models;Joining processes;Analytical models;Data warehouses;Unified modeling language;Data mining","data analysis;data integration;data warehouses;graphs;storage management","deep data warehouse;enterprise IT;structured data analysis;structured data storage;enterprise data;warehouse entities;flexible warehouse data integration;flexible warehouse data enrichment;unstructured content;information-rich instance-level links;warehouse elements;content items;graph-oriented structure;conceptual linking model;logical schema;property graph;DeepDWH;graph database;link-based integration","","5","28","","","","","IEEE","IEEE Conferences"
"Research on Heterogeneous Data Access and Integration Model Based on OGSA-DAI","J. Gao; J. Xiao","Exp. Center, China West Normal Univ., Nanchong, China; Exp. Center, China West Normal Univ., Nanchong, China","2013 International Conference on Computational and Information Sciences","","2013","","","1690","1693","Aiming at the existing problems with traditional integration technology, the system structure, service and workflow of OGSA-DAI are analyzed thoroughly. Based on OGSA-DAI extension, the data heterogeneity of semantic is shielded by schema mapping. An integration model is proposed to solve data integration and distributed query under the grid environment, achieving transparent access to distributed heterogeneous data and associated process.","","978-0-7695-5004-6","10.1109/ICCIS.2013.441","","https://ieeexplore.ieee.org/stamp/stamp.jsp?arnumber=6643360","distributed;heterogeneous;data integration;OGSA-DAI","Data integration;Distributed databases;Data models;Middleware;XML;Computational modeling","data integration;grid computing;query processing","distributed heterogeneous data access;heterogeneous data integration model;OGSA-DAI extension;semantic data heterogeneity;schema mapping;distributed query;grid environment","","","7","","","","","IEEE","IEEE Conferences"
"Some key problems of data management in army data engineering based on big data","X. HongJu; W. Fei; W. FenMei; W. XiuZhen","Department of Computer Science, Army Officer Academy, Hefei, China; Department of Computer Science, Army Officer Academy, Hefei, China; Department of Computer Science, Army Officer Academy, Hefei, China; Department of Computer Science, Army Officer Academy, Hefei, China","2017 IEEE 2nd International Conference on Big Data Analysis (ICBDA)","","2017","","","149","152","This paper analyzed the challenges of data management in army data engineering, such as big data volume, data heterogeneous, high rate of data generation and update, high time requirement of data processing, and widely separated data sources. We discussed the disadvantages of traditional data management technologies to deal with these problems. We also highlighted the key problems of data management in army data engineering including data integration, data analysis, representation of data analysis results, and evaluation of data quality.","","978-1-5090-3619-6","10.1109/ICBDA.2017.8078796","","https://ieeexplore.ieee.org/stamp/stamp.jsp?arnumber=8078796","army data engineering;data management;data integration;data analysis;representation of data analysis results;data quality","Data engineering;Data analysis;Data integration;Big Data;Distributed databases;Data models;Uncertainty","Big Data;data analysis;data integration;military computing","data generation;data processing;data quality;big data;army data engineering;data analysis;data management technologies;data integration","","3","7","","","","","IEEE","IEEE Conferences"
"Informed Design Platform: Interpreting “Big Data” to Adaptive Place Designs","L. You; B. Tunçer","Archit. & Sustainable Design, Singapore Univ. of Technol. & Design, Singapore, Singapore; Archit. & Sustainable Design, Singapore Univ. of Technol. & Design, Singapore, Singapore","2016 IEEE 16th International Conference on Data Mining Workshops (ICDMW)","","2016","","","1332","1335","As a novel concept, ""Informed Design"" is proposed in a multidisciplinary project ""Livable Places"" in Singapore to innovate place design from empirical to evidential by harnessing geo-referenced ""Big Data"" for a responsive design. As a final delivery, an Informed Design Platform (IDP) is being implemented as a design support tool interpreting multi-source big data to adaptive urban designs for a more livable place. Due to the complexity in ""Objects"", which include physical devices and virtual services to generate space related data, ""Data"", which are massive and heterogenous to be interlinked and analyzed for valuable insights, and ""Services"", which integrate back-end and front-end service modules for innovative services, IDP collaborates them through dedicated mechanisms proposed by a Smart Service Orchestration Architecture (SSOA) to achieve a high scalability in data collection, integration, analysis, and visualization. In this paper, the overall design and currently available services of IDP are presented.","2375-9259","978-1-5090-5910-2","10.1109/ICDMW.2016.0197","","https://ieeexplore.ieee.org/stamp/stamp.jsp?arnumber=7836828","Informed Design Platform (IDP);Smart Service Orchestration Architecture (SSOA);Smart Service Orchestration;Multi-source data integration and analysis","Sensors;Cloud computing;Data models;Conferences;Data mining;Social network services;Big data","Big Data;data analysis;data integration;data visualisation;service-oriented architecture","informed design platform;adaptive place designs;livable places multidisciplinary project;IDP;design support tool;multisource Big Data;adaptive urban designs;physical devices;virtual services;front-end service modules;back-end service modules;innovative services;smart service orchestration architecture;SSOA;data collection;data integration;data analysis;data visualization","","4","6","","","","","IEEE","IEEE Conferences"
"Semantic Data Integration Techniques for Transforming Big Biomedical Data into Actionable Knowledge","M. Vidal; S. Jozashoori; A. Sakor","TIB Leibniz Information Centre for Science and Technology, Germany; L3S Institute, Lebniz University of Hannover; L3S Inst., Leibniz Univ. of Hannover, Hannover, Germany","2019 IEEE 32nd International Symposium on Computer-Based Medical Systems (CBMS)","","2019","","","563","566","FAIR principles and the Open Data initiatives have motivated the publication of large volumes of data. Specifically, in the biomedical domain, the size of the data has increased exponentially in the last decade, and with the advances in the technologies to collect and generate data, a faster growth rate is expected for the next years. The available collections of data are characterized by the dominant dimensions of big data, i.e., they are not only large in volume, but they can be also heterogeneous and present quality issues. These data complexity problems impact on the typical tasks of data management, and particularly, in the task of integrating big biomedical data sources. We tackle the problem of big data integration and present a knowledge-driven framework able to extract and integrate data collected from structured and unstructured data sources. The proposed framework resorts to Natural Language Processing techniques to extract knowledge from unstructured data and short text. Furthermore, ontologies and controlled vocabularies, e.g., UMLS, are utilized to annotate the extracted entities and relations with terms from the ontology or controlled vocabulary. The annotated data is integrated into a knowledge graph. A unified schema is used to describe the meaning of the integrated data as well as the main properties and relations. As proof of concept, we show the results of applying the proposed framework to integrate clinical records from lung cancer patients with data extracted from open data sources like Drugbank and PubMed. The created knowledge graph enables the discovery of interactions between drugs in the treatments prescribed to lung cancer patients.","2372-9198","978-1-7281-2286-1","10.1109/CBMS.2019.00116","","https://ieeexplore.ieee.org/stamp/stamp.jsp?arnumber=8787394","Semantic Data Integration;Big Data;Knowledge Graph;Biomedical Data;Natural Language Processing","Drugs;Data mining;Semantics;Data integration;Unified modeling language;Ontologies;Bioinformatics","Big Data;cancer;data analysis;data integration;data mining;lung;medical information systems;natural language processing;ontologies (artificial intelligence)","actionable knowledge;biomedical domain;available collections;data complexity problems impact;data management;big biomedical data sources;big data integration;knowledge-driven framework;unstructured data;annotated data;integrated data;open data sources;created knowledge graph;big biomedical data;open data initiatives;natural language processing techniques;semantic data integration techniques;UMLS;FAIR principles","","","18","","","","","IEEE","IEEE Conferences"
"Design and Implementation of Clinical Data Integration and Management System Based on Hadoop Platform","D. Lyu; Y. Tian; Y. Wang; D. Tong; W. Yin; J. Li","EMR & Intell. Expert Syst. Eng. Res. Center of Minist. of Educ., Zhejiang Univ. Hangzhou, Hangzhou, China; EMR & Intell. Expert Syst. Eng. Res. Center of Minist. of Educ., Zhejiang Univ. Hangzhou, Hangzhou, China; EMR & Intell. Expert Syst. Eng. Res. Center of Minist. of Educ., Zhejiang Univ. Hangzhou, Hangzhou, China; EMR & Intell. Expert Syst. Eng. Res. Center of Minist. of Educ., Zhejiang Univ. Hangzhou, Hangzhou, China; EMR & Intell. Expert Syst. Eng. Res. Center of Minist. of Educ., Zhejiang Univ. Hangzhou, Hangzhou, China; EMR & Intell. Expert Syst. Eng. Res. Center of Minist. of Educ., Zhejiang Univ. Hangzhou, Hangzhou, China","2015 7th International Conference on Information Technology in Medicine and Education (ITME)","","2015","","","76","79","With the increasing size of the medical data, the traditional processing methods and tools could not meet the requirements. So, resolving the challenges that the big medical data faces, is critical to realizing the promise of the big data [1]. Aiming at the problems in the big data integration process, this paper proposes the clinical data integration and management system based on Hadoop platform. As a result, the system can connect with multiple heterogeneous data source, such as EMR, PACS, LIS and so on. And then, on the basis of the data sharing, it can retrieve the patient's medical records and manage the different information.","","978-1-4673-8302-8","10.1109/ITME.2015.86","","https://ieeexplore.ieee.org/stamp/stamp.jsp?arnumber=7429101","Hadoop platform;clinical data;data integration and management","Data integration;Big data;Engines;Servers;Picture archiving and communication systems;Clinical diagnosis;Business","Big Data;data integration;information retrieval;medical information systems;parallel processing","information management;patient medical record retrieval;data sharing;LIS;PACS;EMR;multiple heterogeneous data source;big medical data integration process;Hadoop platform;clinical data integration and management system design;clinical data integration and management system implementation","","3","9","","","","","IEEE","IEEE Conferences"
